ビックスマイル保津川ラフティング,<span>関東から小6息子と2人で参加させていただきました<br/>スタッフの方々は明るく親切で、スタート地点に向かう際もステキな女性スタッフさんが色々説明してくれて緊張がほぐれ助かりました<br/>ラフティングは最っ高に楽しかったです！！！<br/>途中、川の中に入ることも出来ました！かなり暑い日でしたのですごく心地よかったです<br/>同乗してくれた方々もよくしてくださり本当にありがたく、他のボートとの交流もあり、かけがえのない時間になりました<br/>担当していただいたガイドさんは海外経験も豊富なプロフェッショナルで明るく頼もしく、息子は「 スタッフさんみたいにたくましい男になる！」と憧れております！良い経験を与えてくださり感謝しかありません<br/>その後トロッコ列車で心地よい風にあたりながら保津川を眺めて帰りました<br/>スタッフの皆さま、一生心に残る素晴らしい体験をありがとうございました！1年越しの投稿になってしまい申し訳ありません<br/>また機会がありましたら是非よろしくお願いいたします</span>,<span>9月の平日、午前中のコースに参加しました。<br/>ラフティングは初めての体験でした。まずこの会社を選んだのは、<br/>参加費用が安くお手軽な感じがあったためです。<br/>トラブルなく無事にツアーを終えましたが思い返すとホッとすると同時に、ヒヤリ胸をなで下ろす思いを感じた次第です。<br/>その理由は、ガイドのメンバー構成に不安を感じたからです。<br/>当日の参加者は日本人8人、外国人5人でした。ボートは3台で3グループに分けてツアーが始まりました。<br/>日本人のスタッフ1名いたのですが、集合場所での受付業務のみで、各ボートのガイドは3人共外国出身の方でした。<br/>つまり、日本人を主とする参加者のラフティングのボートにガイドは、外国の方のみという状況に驚きました。<br/>もちろん、外国の方でも、日本語も英語もある程度通じるので、今回のように、トラブルがなく順調に運行を終えたなら結果として「楽しい体験ができました・・・チャンチャン」なのですが、ラフティングのような水遊びのツアーで、今回日本人スタッフ無しとする運営会社の安全管理体制に不安を感じました。保事故事例にみられる想定外な自然事象への対処も含めて何処までカバーできる体制であるのか、各ガイドの力量は担保されているのかなどの点が不明（説明も十分でなく）であったと感じさせられました。<br/>今回は（運よく）トラブルもなく良かったですが、次回から参加するのであれば、日本人ガイドさんがいることは確認してから申し込もうと思います。<br/>最後に、京都という都会のこんな近くで自然を満喫でき体験ツアーは貴重だと思いますので参加できてよかったです。</span>,<span>スタッフさんもみんな親切ですごく盛り上げてくれ、テンション上がり楽しかったです！<br/>写真も沢山撮っていただきしかも、笑える決定的瞬間の場面が多くいい思い出が残せました！到着して少し歩かないと行けない時スタッフさんが5歳の子供を肩車していただき本当に助かりました！ありがとうございました、<br/>また行きたいです！！！</span>,<span>ガイドの方がとても盛り上げてくれたので、大変楽しむことができました。写真もたくさん撮り、シェアをしてくれたので大満足です！また来たいです！</span>,<span>着替える所がエアコン付きで綺麗でした。<br/>ラフティングも楽しく、皆さん親切でいい思い出になりました。ありがとうございました。</span>,<span>7歳の子供とファミリーコースに参加させて頂きました。スタッフさんが親切で面白く、ご一緒になった家族さんとも楽しくさせて頂きました！子供も大満足でした。</span>,<span>アメリカからの一時帰国中に小3と中1と参加。関西色々観光しましたが、子供達はこのラフティングが一番楽しかったとのこと。慣れたガイドさんがボートをうまくコントロールしてくれていたので親として安心でした。</span>,<span>インストラクターの方が明るく親しみやすい方で、同じボートになった方とも一緒に途中のゲームなど楽しめました！</span>,<span>飛び込みは、強要するべきではありません。<br/>せっかくの楽しい旅行を潰されたようで、不愉快でした。<br/>本人が飛び込みたいと希望をしていても、なかなか飛び込むことができなく、周りに迷惑をかけてまで、勇気のお手伝いをする必要性を感じません。常連客でしたら尚更プライベートで貸し切りをするなど、方法がはるはずです。いいインストラクターもいる中で、周りの配慮が出来ないインストラクターもいて、残念です。</span>,<span>初ラフティング…参加して来ました。<br/>ガイドの方、とっても優しくて、面白く、めっちゃ楽しませてくれて…サイコ−でした(^^)v<br/>雨が降り、雷さんもありの…思い出に残る1日となりました(≧∀≦)<br/>次回は、仲間を連れてまた参加したいと思います*\(^o^)/*<br/>ほんとにお世話になりました。<br/>素敵な出会いに感謝です。<br/>傘も、気持ち良く貸して頂き…何から何まで、おもてなしに感謝です*\(^o^)/*</span>,<span>仕事仲間と一緒に保津川ラフティングに行きました。<br/>インストラクターさんの人柄がとても素敵で、初めてでしたが、子供に戻った気持ちで大はしゃぎ出来た最高の1日でした。<br/>また、遊びにいきたいとおもいます。ありがとうございました。</span>,<span>初めてのラフティング。ちょっと不安ありましたがガイドさんがすごく親切丁寧に説明と指導して頂き、ﾑｯﾁｬ楽しみました。他の方と相乗りでしたがみんなでキャーキャー笑いながらラフティング。途中、泳いだり、飛び込みしたりと本当に楽しかったです。久しぶりにお腹抱えて笑ってあっという間の半日でした。ウエットスーツのまま電車に乗って帰るのも面白かった。写真もいっぱい撮ってもらって後で見ても笑えます。機会があればまた行きたいです!!!　ありがとうございました。</span>,<span>初めてのラフティング、想像以上に楽しかったです。親切で、楽しく盛り上げて頂いたガイドさんのおかげです。また利用したいです！ありがとうございました。</span>,<span>初めてのラフティングで不安もありましたが、楽しいガイドさんと一緒に色んな事ができて大満足です！！写真もたくさん撮って頂いて本当にいい思い出が出来ました！また2回目も行きたいと思いました！！<br/>ありがとうございました。</span>,<span>はじめてのラフティングで初めは不安でしたがとても楽しい時間を過ごせました！写真をたくさん撮ってほしいと伝えたらたくさん撮ってくださり後からも楽しめる機会をくれました！ガイドさんも明るく楽しい方で最高でした！しゃからかぶんぶん！</span>,<span>ラフティングは危ないイメージがありますがガイドさんが皆さんの命を守りつつ、リスキーな体験をさせてもらえます。<br/>時間があっという間でした！<br/>これだけ楽しく自然豊かな楽しい遊びなのに口コミが少ないのが心苦しいです。<br/>ありがとうございました(^^)</span>,<span>家族４名で人生初のラフティング体験。外国人ガイドさんによるハラハラドキドキの３時間でした。ラフティング時間は思った以上にありましたよ。京都の金閣寺、清水寺も良いと思いますが、小学生、中学生、高校生の子供と一緒にファミリーラフティングは最高の夏休みとなりました。とにかくコスパは最高でラフティング料金も写真料金も大満足です。最後にたいへんお世話になったスタッフさん本当に楽しかった、ありがとーーー。</span>,<span>コロナ禍でなかなか旅行にも行けないこのご時世で、めっちゃ楽しいことしたいと探したのが、ラフティングでした。ガイドさんの、丁寧なレクチャーもあり子どもたちとの参加でしたが、安心して楽しめました！最初は緊張していた子どもたちも、川に飛び込んだり、泳いでみたりと最後は疲れてきっていました。<br/>ノリの良いガイドさんがしっかり舵取りしてくれるので、どんな激流もめっちゃ安心です！１つのボードごとに一体感も生まれて大満足の１日!次も絶対利用します!!!</span>,<span>家族3人で行きました！ボートには一緒に5人グループの方達と乗りましたが、ガイドさんのノリでみんな仲良く楽しめました！川の迫力も申し分なし！写真は最後にデータ2000円で買うことができます！いい写真いっぱい！超大満足です！</span>,<span>ラフティングは、色々な場所で経験があったのですが、なんと言っても、ラフティングはガイドさん次第で良くも悪くも・・・<br/>初めて海外の方でしたが、一生懸命日本語を駆使しながら、楽しく進めてくださいました！！<br/>ツアー中、写真を撮って貰えるのはとても良いです！！<br/>ガイドさんが写真に映り込んで貰えるともっと嬉しいなぁと感じました。<br/>ラフティングの格好で、普通の電車に乗ったのもいい思い出です！！たくさん仲間がいれば怖くない（笑）</span>
大原温泉湯元京の民宿大原の里,お味噌が美味しぃ,お味噌の食べ比べが出来て最高でした,温泉と鍋料理,雨の中の露天風呂も良かった,ボタン鍋,おばんざいがどれも美味しい！,サイクリング後の温泉、味噌ご飯、鍋,お風呂がよろしいです,久しぶりに,お風呂と食事,じゃらんクーポン,サバ味噌が美味しかったです。,心温まるサービス,とても風情のあるお味噌も美味しい温泉宿,大原の味噌,初めて食べた味噌鍋,ぼたん鍋が美味しい,女将さんの最初の対応から,以前から気になってた大原三千院,久しぶりに
大原温泉湯元京の民宿大原の里,4.0,5.0,4.0,4.0,4.0,5.0,5.0,5.0,5.0,1.0,1.0,4.0,5.0,5.0,4.0,4.0,5.0,1.0,3.0,5.0
大原温泉湯元京の民宿大原の里,"
											少し年季は経ってるが庭が眺められる部屋は良い。","
											日帰りの温泉を探していて見つけました。古いながらもゆったりくつろげるお宿でした。着いてすぐに「お食事とご入浴どちらを先にされますか」と選ばせて貰えたので先に食事を。","
											京都に住んでいる妹夫婦と三千院や大原周辺の観光を終わらせてから伺いました。","
											季節外れの大雨&雪の中、内風呂はぬるかったですが、露天風呂は温まりました。","
											ボタン鍋が食べたくてこちらにうかがいました。ずいぶん前に来たことがあったのですが、ほとんど記憶になくて、新鮮な感じでした。鍋の量が結構多いかなと思いましたが、味噌の出汁と猪肉が美味しくて完食しました。最後に出汁の量が減ってきたので、次回は追加してもらおうと思いました。","
											日曜日の利用だったので、混み合ってると思ってましたが","
											日帰り温泉、鳥すき焼プラン。","
											近くにこんなに良い温泉があるなんて！","
											コロナも落ち着いて久しぶりに娘、息子達と味噌鍋を食べに来ました。","
											宿泊客がチェックアウト後の11時半からお風呂に入る為暖房等が入っておらず脱衣所や湯船に浸かっても全く温まらず寒かった。","
											じゃらんクーポンとポイント利用で利用しましたが、大人は","
											真夏の日帰り温泉として利用しました。この暑さでサバ味噌定食が付いていることに、始めは戸惑いましたが、手作り味噌がおいしく、そのお味噌なのでサバも美味しいのかな？と思いました。宿のご主人からサバ街道にあるのでサバを定食にしたいとお話しされました。お風呂もよかったです。次回は宿泊したいと思いました。
										","
											寂光院からほど近く、豊かな自然に囲まれた静かな旅館で、夫婦でほっこり寛ぐことができました。日帰りでしたが、美味しい味噌鍋と温泉を満喫。心温まるおもてなしをしていただきました。また家族で泊まりたいです。
										","
											私と、家内とのじゃらんアカウントで今まで数回利用しています。","
											写真で見た味噌鍋に惹かれていきましたが、予想通り量も味も良かったです。","
											コロナも少し落ち着き、ワクチン接種で割引のキャンペーンで友達と２人で利用しました。","
											家族３人で利用しました。近くの三千院に観光した後、ぼたん鍋が食べたくて予約しました。大広間でぼたん鍋をいただきました。子どもも喜んで食べていてよかったです。お風呂も人がおらず貸し切り状態だったので2歳の子どもと気にせずのんびり堪能出来て久しぶりにゆっくりできました。","
											入湯時間には早く着いたので、寂光院の散策の後","
											　大阪から京都に引っ越しして7年目。大阪に住みながら大阪城行ったのは引っ越すちょっと前。京都大原三千院と歌にも出てくるが気になりながらも足を運ぶ機会がありませんでした。じゃらんを利用し始めたのが今年6月。今まで窓口利用が当たり前でしたがコロナ禍で利用しづらくなりこちらをりし始めました。利用しだすと色々お得プランも出て前よりも気軽にお得に出掛けることが増えました。今回も何気なく見てたら大原の里日帰り温泉と味噌鍋プラン。ワクチン二回接種証明で割引プラン。妻と休みも重なり行くことに決めました。市内から山の方へ突き進みました。途中道も狭くなり不安になりました。対向車来たら広い場所で離合。到着したら駐車場スペース狭く停めるのに苦労しました。そうこうしてるうちに宿泊の方が徐々にチェックアウトし広く使えました。到着したらこちらとしては温泉入って食事を予定してましたが受付で「今お風呂入られてるので先に食事してお風呂で！」と言われたので「えつ？」と思い「お風呂先ではダメですか？」と聞いたら「もう少ししたら出てこられるので12:00に戻ってきてください。近くにお寺もあるので見てたら直ぐに時間なる。」と言われそうしました。この辺の案内が事前にほしかったと思います。戻ってきて風呂場へ行くと2箇所あり暖簾がある方ない方どちらが男湯女湯が分からずフロントは聞きに行きました。暖簾ある方でと言われ尚且つ貸し切り混浴だと初めて知りました。夫婦だから良しだけどもし若い男女友達同士なら困ったと思います。この辺も説明が欲しかったです。お風呂は二人なら十分な広さでのんびりできましたがシャワー調整が昭和式みたいに一定の温度にキープするのが難しく熱くなり気味なので気をつけないとダメです。貸切時間いっぱい入らせていただき満足でした。食事は大広間で4組くらい鍋が並べてありました。見た時は机が6あったので１つ空けてくれたらないいのにと思いましたが他のお客さんと被ることがなく貸切でした。見た感じは少ないなぁと思いました。でも味噌鍋なので鍋の中全部食べられるので満腹になりました。外の景色も見えて外から見てる人は何食べてるんやろ？とよく覗いてました。鶏肉、野菜とシンプルですがこの値段で割引して食事、お風呂入れるならお手頃でした。今までお寺など興味ありませんでしたが三千院拝観させていただいてリフレッシュできました。
										","
											久し振りに日帰り温泉の味噌鍋を食べに行きました。いつ食べても美味しいです。"
西本願寺,カードをもらえるのが嬉しい。,荘厳,無料で中まで観られるすごい場所,朝のお勤め,やっと行きました,案内付き、最高,西か東か,イチョウが見頃でした！,唐門が見ごたえ有りました、,ひぐらし文は絶対に見る価値ありです！,浄土真宗,夕方のおつとめに,美しすぎる西本願寺,素晴らしい歴史感,親鸞聖人法要,えりぴさんのクチコミ,やはり、中に入りたい！！,参拝してきました,荘厳,柱が大きくて驚きました
西本願寺,5.0,5.0,5.0,5.0,4.0,5.0,4.0,5.0,4.0,5.0,5.0,5.0,5.0,5.0,5.0,1.0,5.0,5.0,3.0,4.0
西本願寺,<span>この一年間、西本願寺にぞっこんです。<br/>毎日3-4回お寺さんがお西さんのホットスポットを案内してくれるツアーがあります。戒律に束縛されない自由で楽しいツアーです。毎回内容と案内者が異なるので楽しみです。仏教を知らない人に分かりやすく教えてくれます。<br/>最後にスポットの写真のカードは24枚あるそうですが、現在4枚です。</span>,<span>境内の大銀杏は圧巻です。建物の荘厳さに圧倒されますが、廊下の木目を足に感じながら歩いたり、装飾や仏具などじっくり見るのもおすすめです。</span>,<span>気持ちが穏やかになる場所…素晴らしい所なので、ぜひ立ち寄るべきである。駅からも徒歩圏内のため良かった。何度訪れてもいい場所である</span>,<span>京都へ行く時は、必ず西本願寺の朝のお勤めに参加しています。<br/>もちろん門徒なのですが、誰でもokです。<br/>朝６時から１時間、阿弥陀堂から御影堂に挑むしながらのお勤めです。</span>,<span>駅から近いのに今まで行ったことがなかった。思っていたよりも広くて大きくてびっくりした。混んでいなかったのでゆっくり見れました。</span>,<span>京都冬の旅で予約して案内付きでまわりました。やはり案内があると違います。午前中しか空いていなかっのでかなり早い自宅出発になりましたが、その価値アリ。ありがたかったです。京都の魅力は歴史が作ってるし、現代の修復する技術は凄すぎる。</span>,<span>東本願寺から、回りました。<br/>駅から離れてるせいか、観光客が少なめだし<br/>売店は無いし、写真はOKだし<br/>良心的に思いました。<br/>銀杏や、天邪鬼、日暮らしの門を見せて頂きました。</span>,<span>北境内地駐車場（無料）に車を停めて拝観しました。入場も無料です。二つの本堂（御影堂と阿弥陀堂）はすばらしく渡り廊下でつながっています。良いお参りができました。逆さイチョウが見頃でした。（添付写真）</span>,<span>本堂と御影堂が見学出来ます、浄土真宗の本山だけありとても立派です、建物外、建物内も圧倒されます。<br/>大銀杏も有名らしいです、私は横の通路を入っていくと唐門が修復されて間もないらしくとてもステキでした。</span>,<span>10回以上京都に通っていますが、いつも京都駅から西本願寺と東本願寺を眺めるだけで、今回初めて西本願寺に行ってきました。とても広い境内を見学した後、ひぐらし門を見て感動しました。皆さんも京都駅から少し頑張れば歩いて行けるのでぜひご覧になってみてください。</span>,<span>同宗派の者としては、一度は来てみたかった場所、素晴らしいしあまりの大きさで見学に大変時間がかかりましたが、宗派に関係なく一度は見ておくのもいいかも。</span>,<span>夕方4時からのおつとめに参加させていただきました、厳粛な感じです、たくさんの方が来られていました。5<br/>時迄は中でゆっくりしました。</span>,<span>日本中から沢山の方が来られていて、国宝の建物も見ることができ、京都へ来たなって思いで、端から端まで見ました。とても貴重な時間を過ごしたと感動しております。</span>,<span>西本願寺も今回の旅行の計画にありました。ココは訪れる価値あります。<br/>分骨されている親族のお参りも兼ねて訪問しました。</span>,<span>お寺の前に立った時　とても綺麗で盛大な感じでした。また、なかの方に丁寧に受付やお寺のおはなししていただきました。仏様を拝み心落ちつきました。</span>,<span>父の命日供養に行きました。コロナ5類になり様々な法要で観光客を今まさに集客し、この数年の落ち込んだ収入を補填したいのが見え見えです。ここで永代供養ている私達の事は全く眼中に無いようです。コロナで観光客が激減した経験が見事に裏目に出た典型でした。後日、別のお寺で法要しなおす予定です。</span>,<span>着いたのときは5時半くらいで、もう閉まってました‥<br/>外から写真を撮りましたが、ホテルに着いてからやはり中に入ってみたくて次の日の朝、早起きして行きました！<br/>でも御朱印もらうの忘れた〜</span>,<span>朝イチのお勤め大変すがすがしい又修学旅行生も参加いつ来ても清々しく流石御本山ですね私自身西本願寺で5年前帰敬式お受けし法名頂き西本願寺さんの門徒で年３回程大谷本廟に墓参りと御本山西本願寺に参拝してます元気な限り参拝続ける考えです南無阿弥陀南無阿弥陀</span>,<span>ゆっくりできるようパイプ椅子もおいてある。お経を聞いているとなんとなくすっきり。出入りも自由なので気軽に立ち寄れる。</span>,<span>西本願寺　お西さん<br/>浄土真宗は、鎌倉時代の中頃に親鸞聖人によって開かれました。とても広く、柱が大きくて素晴らしかったです。</span>
渡月橋,今年は川の水が少なめ。,やっぱいいね,風情が感じられて良かった,いつ行ってもいいね,絶景,インバウンドで賑わう渡月橋,渡月橋,何時も混雑しています,桜が綺麗,紅葉の時　めっちゃ　きれかった,嵐山と言ったらここ,京都中の京都,景色最高,紅葉が美しい嵐山渡月橋,渡月橋と背景に嵐山,行楽の秋,渡月橋からみる紅葉,景観保護の工夫は素晴らしい,大混雑！！,昼間の観光
渡月橋,5.0,5.0,4.0,5.0,5.0,4.0,4.0,5.0,5.0,5.0,5.0,5.0,4.0,5.0,5.0,4.0,5.0,4.0,5.0,4.0
